{
  "schema_version": 1,
  "plan_id": "plan-public-linear-0001",
  "request_id": "request-public-fixture-0001",
  "dry_run": true,
  "step_budget": 2,
  "timeout_ms": 60000,
  "created_at": "2026-08-10T09:15:00Z",
  "public_log_safe": false,
  "steps": [
    {
      "id": "s1",
      "tool": "android.open_gallery",
      "tool_version": 1,
      "risk": "low",
      "depends_on": [],
      "arguments": {"fixture": "synthetic"},
      "idempotency_key": "idem-public-step-s1"
    },
    {
      "id": "s2",
      "tool": "android.observe",
      "tool_version": 1,
      "risk": "observe",
      "depends_on": ["s1"],
      "arguments": {},
      "idempotency_key": "idem-public-step-s2"
    }
  ]
}
